<?xml version="1.0" encoding="UTF-8"?>
<?xml-stylesheet type="text/xsl" href="users.xsl"?>

<users xmlns="http://www.uts.edu.au/31284/wsd-users"
       xmlns:xsi="http://www.w3.org/2001/XMLSchema-instance"
       xsi:schemaLocation="http://www.uts.edu.au/31284/wsd-users users.xsd">
    <user>
        <name>Ryan Bradley</name>
        <email>ryan@bradley.com</email>      
        <password>blahblah88</password> 
        <phone>(02) 9999-1111</phone>       
    </user>
    <user>
        <name>Joe Bloggs</name>
        <email>joe@bloggs.com</email>        
        <password>foobar222</password>     
        <phone>(04) 2288-1122</phone>   
    </user>
    <user>
        <name>Georges Bou Ghantous</name>
        <email>georges.boughantous@gmail.com</email>    
        <password>tutorial124</password>    
        <phone>(03) 1234-0000</phone>         
    </user>  
    <user>
        <name>Joe Bloggs</name>
        <email>joe@bloggs.com</email>        
        <password>foobar222</password>     
        <phone>(04) 2288-1122</phone>   
    </user>  
</users>